{
  "$schema": "https://json-schema.org/draft/2020-12/schema",
  "$id": "https://echelonfoundry.com/schemas/conditor-component/v1",
  "title": "Conditor Component Descriptor",
  "type": "object",
  "additionalProperties": false,
  "required": [
    "schemaVersion",
    "id",
    "displayName",
    "distribution",
    "package",
    "defaultVersion",
    "qualifiedVersions",
    "initArguments",
    "verifyArguments",
    "doctorArguments",
    "upgradeArguments"
  ],
  "properties": {
    "schemaVersion": { "const": 1 },
    "id": { "type": "string", "pattern": "^[a-z0-9-]+$" },
    "displayName": { "$ref": "#/$defs/nonBlankString" },
    "distribution": { "enum": ["host-tool", "lifecycle-npm", "npm", "nuget"] },
    "package": {
      "$ref": "#/$defs/nonBlankString",
      "description": "The component's current package identity. Qualified versions not listed in historicalPackages are distributed under this name."
    },
    "historicalPackages": {
      "type": "array",
      "description": "Earlier package identities. Each entry owns an explicit set of qualified versions that were published only under that name. A version may appear in at most one entry, an entry may not repeat the current package, and defaultVersion must use the current package.",
      "items": {
        "type": "object",
        "additionalProperties": false,
        "required": ["package", "versions"],
        "properties": {
          "package": { "$ref": "#/$defs/nonBlankString" },
          "versions": {
            "type": "array",
            "minItems": 1,
            "uniqueItems": true,
            "items": { "$ref": "#/$defs/nonBlankString" }
          }
        }
      }
    },
    "defaultVersion": { "$ref": "#/$defs/nonBlankString" },
    "qualifiedVersions": {
      "type": "array",
      "minItems": 1,
      "uniqueItems": true,
      "items": { "$ref": "#/$defs/nonBlankString" }
    },
    "qualifiedRange": {
      "description": "Project bindings only: the release line this build qualifies under a verified Registry release attestation (CON-341, DF-CON-2026-A004). Lifecycle tools keep exact qualifiedVersions (CON-343).",
      "type": "string",
      "pattern": "^\\s*((>=|<=|>|<|=)?\\d+\\.\\d+\\.\\d+(-[0-9A-Za-z.-]+)?\\s*)+$"
    },
    "deniedVersions": {
      "description": "Versions refused even inside qualifiedRange (CON-345).",
      "type": "array",
      "uniqueItems": true,
      "items": { "$ref": "#/$defs/nonBlankString" }
    },
    "lifecycleSource": {
      "oneOf": [
        {
          "type": "object",
          "additionalProperties": false,
          "required": ["kind"],
          "properties": { "kind": { "const": "registry" } }
        },
        {
          "type": "object",
          "additionalProperties": false,
          "required": ["kind", "repository", "commit", "entrypoint"],
          "properties": {
            "kind": { "const": "github" },
            "repository": { "type": "string", "pattern": "^[A-Za-z0-9_.-]+/[A-Za-z0-9_.-]+$" },
            "commit": { "type": "string", "pattern": "^[0-9a-fA-F]{40}$" },
            "entrypoint": {
              "type": "object",
              "additionalProperties": false,
              "required": ["kind", "path"],
              "properties": {
                "kind": { "enum": ["node-script", "file-artifact"] },
                "path": { "$ref": "#/$defs/nonBlankString" }
              }
            }
          }
        }
      ]
    },
    "applicationBinding": {
      "enum": ["npm", "nuget"]
    },
    "command": { "$ref": "#/$defs/nonBlankString" },
    "versionArguments": {
      "$ref": "#/$defs/stringArray",
      "description": "Read-only argument vector that makes `command` report the installed component version, used by existing-repository adoption. Required and non-empty for host-tool and lifecycle-npm components."
    },
    "initArguments": { "$ref": "#/$defs/stringArray" },
    "verifyArguments": { "$ref": "#/$defs/stringArray" },
    "doctorArguments": { "$ref": "#/$defs/stringArray" },
    "upgradeArguments": { "$ref": "#/$defs/stringArray" },
    "installationMarkers": {
      "type": "array",
      "minItems": 1,
      "uniqueItems": true,
      "items": {
        "type": "string",
        "pattern": "^(?!/)(?![A-Za-z]:)(?!.*\\\\)(?!(?:.*/)?\\.{1,2}(?:/|$))(?!.*//)[^/].*[^/]$|^[^/\\\\.]$"
      },
      "description": "Repository-relative, forward-slashed paths whose presence shows the component is installed in a repository. When declared and none exists, adoption reports the component not-found without consulting its command, because a CLI installed on the machine says nothing about the repository."
    },
    "integrityGate": {
      "type": "object",
      "description": "A verification that fails closed on installation integrity and reports structural review signals without failing. Used instead of verifyArguments for exactly the listed qualified versions; every other version keeps verifyArguments.",
      "additionalProperties": false,
      "required": ["report", "versions", "arguments"],
      "properties": {
        "report": {
          "const": "ordo.verify-json/v1",
          "description": "The report format Conditor interprets: a JSON object with passed, typed failures (category, code, detail) and reviewSignals (code, band, path, lineCount). Any failure whose category is not structural-review fails closed."
        },
        "versions": {
          "type": "array",
          "minItems": 1,
          "uniqueItems": true,
          "items": { "$ref": "#/$defs/nonBlankString" },
          "description": "Qualified versions that carry this gate."
        },
        "arguments": {
          "$ref": "#/$defs/stringArray",
          "minItems": 1
        }
      }
    }
  },
  "allOf": [
    {
      "if": { "required": ["distribution"], "properties": { "distribution": { "const": "host-tool" } } },
      "then": {
        "required": ["command", "versionArguments"],
        "properties": { "versionArguments": { "minItems": 1 } },
        "not": { "required": ["lifecycleSource"] }
      }
    },
    {
      "if": { "required": ["distribution"], "properties": { "distribution": { "const": "lifecycle-npm" } } },
      "then": {
        "required": ["lifecycleSource", "command", "versionArguments"],
        "properties": { "versionArguments": { "minItems": 1 } }
      }
    },
    {
      "if": { "required": ["distribution"], "properties": { "distribution": { "const": "npm" } } },
      "then": { "required": ["applicationBinding"], "properties": { "applicationBinding": { "const": "npm" } } }
    },
    {
      "if": { "required": ["distribution"], "properties": { "distribution": { "const": "nuget" } } },
      "then": { "required": ["applicationBinding"], "properties": { "applicationBinding": { "const": "nuget" } } }
    }
  ],
  "$defs": {
    "nonBlankString": {
      "type": "string",
      "pattern": "\\S",
      "description": "A string with at least one non-whitespace character, matching the loader's refusal of empty and whitespace-only values."
    },
    "stringArray": {
      "type": "array",
      "items": { "type": "string" }
    }
  }
}
