{
  "schemaVersion": 1,
  "id": "forma",
  "displayName": "Forma",
  "distribution": "npm",
  "package": "@echelon-foundry/design-system",
  "defaultVersion": "0.5.0",
  "qualifiedVersions": [
    "0.2.0",
    "0.3.0",
    "0.4.1",
    "0.5.0",
    "0.6.1",
    "0.9.0",
    "0.10.0",
    "0.11.0",
    "0.12.0"
  ],
  "qualifiedRange": ">=0.2.0 <1.0.0",
  "applicationBinding": "npm",
  "initArguments": [],
  "verifyArguments": [],
  "doctorArguments": [],
  "upgradeArguments": []
}
