{
  "schemaVersion": 1,
  "id": "praxis",
  "displayName": "Praxis / Repository Operating System",
  "distribution": "host-tool",
  "package": "praxis",
  "defaultVersion": "3.6.0",
  "qualifiedVersions": [
    "3.1.3",
    "3.1.4",
    "3.6.0",
    "3.7.1",
    "3.7.2",
    "3.10.0",
    "3.11.0",
    "3.12.0",
    "3.14.0",
    "3.16.0"
  ],
  "versionArguments": [
    "--version"
  ],
  "command": "praxis",
  "initArguments": [
    "init"
  ],
  "verifyArguments": [
    "verify",
    "--strict"
  ],
  "doctorArguments": [
    "doctor"
  ],
  "upgradeArguments": [
    "upgrade"
  ]
}
