{
  "schemaVersion": 1,
  "id": "limen",
  "displayName": "Limen",
  "distribution": "npm",
  "package": "@echelon-foundry/limen",
  "historicalPackages": [
    {
      "package": "@echelon-foundry/typescript-wasm-kernel",
      "versions": [
        "0.6.1",
        "0.6.2"
      ]
    }
  ],
  "defaultVersion": "0.9.0",
  "qualifiedVersions": [
    "0.6.1",
    "0.6.2",
    "0.7.0",
    "0.7.1",
    "0.9.0",
    "0.9.1"
  ],
  "qualifiedRange": ">=0.6.1 <1.0.0",
  "applicationBinding": "npm",
  "initArguments": [],
  "verifyArguments": [],
  "doctorArguments": [],
  "upgradeArguments": []
}
