{
  "schemaVersion": 1,
  "id": "communication-engineering",
  "displayName": "Communication Engineering",
  "distribution": "lifecycle-npm",
  "package": "@echelon-foundry/communication-engineering",
  "defaultVersion": "1.0.0",
  "qualifiedVersions": [
    "1.0.0"
  ],
  "lifecycleSource": {
    "kind": "github",
    "repository": "kemiller2002/communication-engineering",
    "commit": "707396de512065fe35aff6fcf82cd28118df14b3",
    "entrypoint": {
      "kind": "node-script",
      "path": "bin/communication-engineering.mjs"
    }
  },
  "versionArguments": [
    "--version"
  ],
  "command": "communication-engineering",
  "initArguments": [
    "init"
  ],
  "verifyArguments": [
    "verify",
    "--strict"
  ],
  "doctorArguments": [
    "doctor"
  ],
  "upgradeArguments": [
    "upgrade"
  ],
  "installationMarkers": [
    ".echelon/communication-engineering.json",
    ".echelon/communication-engineering.config.json",
    ".communication-engineering"
  ]
}
